Wikidata ID,Relation,Template
P54,member of sports team,"While <subject1> was playing for <object1>, who was also playing for <object1> "
P39,position held,"While <subject1> was holding the position of <object1>, who also held the position of <object1> "
P108,employer,"While <subject1> was working for <object1>, who also worked for <object1> "
P102,political party,"While <subject1> was a member of <object1>, who was also a member of <object1> "
P69,educated at,"While <subject1> attended <object1>, who also attended <object1> "
P127,owned by,"While <subject1> was owned by <object1>, who was also owned by <object1> "